{
  "schema_version": 1,
  "case": "solid_static",
  "description": "Cylindrical shell (Ri 100, Ro 120, H 300 mm) with a radial nozzle (ri 25, ro 35 mm, open end at X = 220 mm), base fixed, 2 MPa internal pressure. Linear tetrahedra, linear elastic steel.",
  "title_block": {
    "project": "codeaster-en fixtures",
    "title": "Nozzle in cylindrical shell, internal pressure",
    "revision": "A",
    "author": "codeaster-en",
    "date": "2026-10-23"
  },
  "analysis": "linear_static",
  "units": {
    "system": "SI_mm"
  },
  "groups": {
    "SOLID": {
      "display_name": "Shell and nozzle",
      "role": "body",
      "report": true
    },
    "BASE": {
      "display_name": "Fixed base (Z = 0)",
      "role": "support",
      "report": true
    },
    "TOP": {
      "display_name": "Free top edge (Z = 300)",
      "role": "free"
    },
    "NOZ_END": {
      "display_name": "Open nozzle end",
      "role": "free"
    },
    "P_SHELL": {
      "display_name": "Shell inner wall (pressure)",
      "role": "load"
    },
    "P_NOZZLE": {
      "display_name": "Nozzle bore (pressure)",
      "role": "load"
    }
  },
  "sections": [
    "title_block",
    "summary",
    "model",
    "materials",
    "loads_and_bcs",
    "solution",
    "displacements",
    "stresses",
    "reactions",
    "diagnostics",
    "verification",
    "appendix_command_file",
    "appendix_run_parameters"
  ],
  "solver": {
    "linear_solver": "MUMPS",
    "ncpus": 1,
    "time_limit_s": 600,
    "memory_limit_mb": 2048
  },
  "checks": [
    {
      "legend": "REAC_DX_SUM",
      "quantity": "Sum of X reactions at the base [N]",
      "field": "REAC_NODA",
      "component": "DX",
      "reference": 3891.64,
      "precision": 0.001,
      "basis": "Equilibrium: reaction sum = -(applied pressure resultant), so +X (REAC_NODA is the support reaction; sign confirmed by the first run, task 4.2). With the nozzle end open, the resultant is P times the projected area of the bore opening along -X (P pi ri^2 = 3927 N for a true circle); the reference is the exact resultant on the faceted mesh, computed by tests/fixtures/hand_values.py (applied FX = -3891.64 N, FY = FZ = 0).",
      "source": "Static equilibrium; mesh integration in tests/fixtures/hand_values.py:pressure_resultant"
    }
  ],
  "provenance": {
    "upstream_version": "17.4.26",
    "modelled_on": [
      "forma01a",
      "zzzz341b"
    ],
    "author": "codeaster-en agent (task 4.1)",
    "date": "2026-10-23",
    "notes": "VALE_CALC in run.comm is the solver's own value from the first run (task 4.2, code_aster 17.4.22 image, ADR-011). Outputs are in ../output/."
  }
}
